{
  "$schema": "https://json-schema.org/draft/2020-12/schema",
  "title": "verdict/v1",
  "description": "A review session's verdict: .loop/tmp/verdict.json",
  "type": "object",
  "required": ["schema", "task", "verdict", "criteria", "findings", "notes"],
  "properties": {
    "schema": { "const": "verdict/v1" },
    "task": { "type": "string" },
    "verdict": { "enum": ["PASS", "FAIL"] },
    "criteria": {
      "type": "array",
      "items": {
        "type": "object",
        "required": ["criterion", "met", "evidence"],
        "properties": {
          "criterion": { "type": "string" },
          "met": { "type": "boolean" },
          "evidence": { "type": "string" }
        }
      }
    },
    "findings": {
      "type": "array",
      "items": {
        "type": "object",
        "required": ["summary", "kind"],
        "properties": {
          "summary": { "type": "string" },
          "kind": { "enum": ["bug", "spec-gap", "gate-gap"] }
        }
      }
    },
    "notes": { "type": "string" }
  }
}
