{
  "schema": "verdict/v1",
  "task": "T10",
  "verdict": "PASS",
  "criteria": [
    {"criterion": "For each brief, at the commit its delivered lines are measured to (M-2), each session kind's figure is its skill + .vloop/repo-guidelines.md + the root CLAUDE.md, each counted as L10 counts (wc -w) and 0 when absent; a kind's skill is plugin/skills/<kind>/SKILL.md, else for plan, work and review the shell loop's .claude/skills/loop-<kind>/SKILL.md, else the kind is n/a; the rule count is the guidelines file's rules (L9)", "met": true, "evidence": "internal/metrics/instructions.go MeasureInstructions reads git show at planSHA(o) (the run's last commit, metrics.go:204); plugin skill, shell-loop fallback for plan/work/review only, nil otherwise; rules via budget.GuidelineRules moved from doctor.go (same code)"},
    {"criterion": "The brief summary gains, right after the interventions line: ` instructions  plan <n> · gate review <n> · work <n> · review <n> words · guidelines <n> rules`, numbers with thousands separators, n/a for a missing kind", "met": true, "evidence": "print.go:126-135 prints it right after interventions with thousands() and n/a; TestPrintSummaryInstructions pins the exact line"},
    {"criterion": "--json gains an optional object `instructions`: {\"plan\": n|null, \"gate_review\": n|null, \"work\": n|null, \"review\": n|null, \"guidelines_rules\": n}; metrics/v2 gains it as an optional property with no version change; brief close's snapshot carries it", "met": true, "evidence": "Report.Instructions omitempty in metrics.go; schemas/metrics.v2.json adds optional property (not in required); live `vloop metrics B13 --json` emits it; the snapshot is the Report"},
    {"criterion": "Computed from git (M-1); nothing is recorded during a run; no instructions column in the all-briefs table", "met": true, "evidence": "only git show calls at Build time; no change to the all-briefs table in print.go"},
    {"criterion": "Tests that pin the brief summary line by line (internal/metrics/print_test.go, internal/cli/metrics_test.go, cmd/vloop/b3_e2e_test.go, cmd/vloop/b4_e2e_test.go) change only by the instructions line; committed tests cover the worked example's temporary repository (100- and 50-word skills, n/a kinds, 6 rules), the shell-loop fallback and --json. Violation: the behaviour shipped with no committed test the checks run", "met": true, "evidence": "cli/metrics_test.go and b3_e2e_test.go each gain only the one instructions line; instructions_test.go has the worked example (100/50 words, 6 rules, null kinds), the shell-loop fallback and the JSON shape; go check passed"},
    {"criterion": "vloop metrics exits 0 for every consumed brief in this repository, and B13's plan figure equals git show <end>:plugin/skills/plan/SKILL.md | wc -w plus git show <end>:CLAUDE.md | wc -w", "met": true, "evidence": "ran vloop metrics over every loop brief: all exit 0 (the architect-brief has no run and is not consumed); B13 plan 4,426 equals the plan SKILL + CLAUDE.md word counts at its run commit (9efb57f)"},
    {"criterion": "No earlier test is weakened: only the tests the brief's Constraints list change, and only as they state", "met": true, "evidence": "diff touches only the added summary line in two test files; doctor tests unchanged; guideline function moved to internal/budget with identical body"}
  ],
  "findings": [],
  "notes": "B1-B3 briefs share the same figures, as expected from the same commit's skills. none otherwise."
}
