{
  "schema": "verdict/v1",
  "task": "T7",
  "verdict": "PASS",
  "criteria": [
    {"criterion": "plan-checks-its-gates: the grader that judges the planner's gate-folder fixtures reads the files under .vloop/state/gates/ the session wrote, through a grader focus or target naming a file (a directory focus throws, as D20261006-1028's T14 defect records), not the trace", "met": true, "evidence": "graders/fixture-at-top-level.md now has focus {source: file, path: .vloop/state/gates/T1/gate.sh}, a file not a directory; brief.md gains a 'Plan shape' section pinning one task T1 with that gate script, so the path is deterministic"},
    {"criterion": "operate-proposes-options: the scaffold puts the plan and the iterations on a work branch named for the run id (the plan's run_id and branch), main untouched by them; the plan validates as state/v2 and has at least three tasks, the first done, the second blocked on a gate dispute", "met": true, "evidence": "scaffold.sh commits only the baseline on main, then git switch -c $RUN_ID and commits plan, T1 done and T2 blocked there; plan run_id and branch both = $RUN_ID; tasks = [done T1, blocked T2 with dispute notes, pending T3]; gate T7 log reports 'gate T7: ok' and its script validates state/v2, branch name, main without plan, and task statuses"},
    {"criterion": "operate-proposes-options' graders score what the skill's step names: one to three real options, one recommended with its reason, no gate amended before the operator answers, no straw option; a sound answer that does these is not failed by wording or focus", "met": true, "evidence": "options-with-recommendation.md now states the skill's step (up to three options, one recommended with a reason, wait for operator), scores only the gate, ignores wording and numbering, and accepts a single obvious course; no-straw-option.md accepts one or two real options and fails only a padded straw; the two tool_used graders for the gate are unchanged"},
    {"criterion": "Only these two cases change, in the format of docs/guide/evals.md; their README rows stay accurate; the skill checks accept them. Violation: any eval case changed beyond L6 and L7; a case format, grader type or field not in docs/guide/evals.md", "met": true, "evidence": "git status shows plugin changes only under plugin/evals/operate-proposes-options and plugin/evals/plan-checks-its-gates; grader frontmatter uses llm type with focus {source: file, path} as in evals.md and the other cases; README rows (lines 48 and 52) still describe the cases correctly; Go checks log exit 0"}
  ],
  "findings": [],
  "notes": "The task.json id changed T1 to T2 and gained depends_on T1; the prompt was updated to match. The evals themselves were not run (real model calls), so whether the repaired graders now score a correct answer at 1 is unmeasured; the brief's own verification should run them."
}
