{
  "schema": "verdict/v1",
  "task": "T11",
  "verdict": "PASS",
  "criteria": [
    {"criterion": "vloop defect set <id> rule '<where>: <which>' accepts <where> in guideline, brief-check, gate, gate-review, review, skill; vloop defect set <id> rule-outcome accepts fired, missed, absent, none; anything else exits 2 and leaves the record byte-identical", "met": true, "evidence": "internal/defect/defect.go validation; TestSetRuleAndOutcome asserts InvalidValueError and a byte-identical file (committed in 807808a, unchanged)"},
    {"criterion": "defect/v1 gains `rule` and `rule-outcome` as optional properties: no schema version changes and records without them stay valid; vloop defect set's help lists the two fields and docs/guide/commands.md is regenerated", "met": true, "evidence": "schemas/defect.v1.json adds both, not required; docs/guide/commands.md updated"},
    {"criterion": "vloop brief close prints, after recording the findings and before its `squash-merge with the trailer` line (which stays last), `defects of <run id>` then one line per defect recorded for the brief: `  <id>  <kind>  <found-by>  <rule or —>  <rule-outcome or untriaged>[  recurs ×<n> (<id>, <id>)]`; then, when any is untriaged, `<n> untriaged: vloop defect set <id> rule '<where>: <which>' and rule-outcome fired|missed|absent|none`, <n> the number of untriaged defects and the rest literal; with no defects, `defects of <run id>: none`", "met": true, "evidence": "internal/cli/close.go printDefectReport; TestCloseDefectReport asserts the lines and that the trailer stays last; TestCloseDefectReportNone"},
    {"criterion": "recurs lists the other defects, of any brief, with the same rule, by short ID (D<stamp>), oldest first, at most three, with the total count; an untriaged defect never recurs", "met": true, "evidence": "close.go:307 now gates the recurs suffix on d.Rule != \"\" && d.RuleOutcome != \"\"; TestCloseDefectReport adds D20260102-1300-ruled (rule, no outcome) and asserts it prints untriaged with no recurs, and the 4-old cap at three ids with ×5 total"},
    {"criterion": "--dry-run prints the report as it would be and writes nothing; --json is unchanged; close never refuses for an untriaged defect. Violation: a close that refuses, or a report that writes anything, for an untriaged defect", "met": true, "evidence": "closeDryRun prints the report; TestCloseDefectReport checks clean porcelain status and unchanged HEAD after --dry-run, and exit 0 with untriaged defects"},
    {"criterion": "plugin/skills/operate/SKILL.md's close step gains the triage: for each untriaged defect propose its rule and rule-outcome as options and record the operator's choice; for absent, draft the guideline line with its provenance, or the check; for a gate-review rule that missed, propose an eval case and the defect's case:. The skill stays within its 1,750-word ceiling and changes nowhere else", "met": true, "evidence": "SKILL.md step 3 added in 807808a, only in the close step, ~1686 words; untouched this attempt"},
    {"criterion": "TestCloseCommitsFindingsSnapshotAndBrief (internal/cli/close_test.go) and B4's worked-example test (cmd/vloop/b4_e2e_test.go) change only by the report's lines before the trailer; committed tests cover the two fields, both refusals, the report with rule, untriaged and recurs, no defects and --dry-run. Violation: the behaviour shipped with no committed test the checks run", "met": true, "evidence": "tests in internal/defect/defect_test.go and internal/cli/close_test.go cover each listed case; b4_e2e_test.go untouched; go check exit 0"},
    {"criterion": "No earlier test is weakened: only the tests the brief's Constraints list change, and only as they state", "met": true, "evidence": "this attempt's diff only touches TestCloseDefectReport (added in this task) and a one-line condition in close.go"}
  ],
  "findings": [],
  "notes": "The previous FAIL (recurs shown on a rule-without-outcome defect) is fixed. A rule-only defect still counts toward other defects' recurs, which the gate requires (old defects carry a rule only). The brief could state explicitly that untriaged means no rule-outcome."
}
