{
  "schema": "verdict/v1",
  "task": "T8",
  "verdict": "PASS",
  "criteria": [
    {"criterion": "`vloop metrics <brief> --by task` gains two columns between other+ and agent: test:code (the task's test+ / code+) and $/kloc (the task's cost per 1,000 of its code+ lines, no $ sign), both with two decimals and both `-` where code+ is 0. A task with code+ 200, test+ 300 and cost 0.50 shows 1.50 and 2.50.", "met": true, "evidence": "internal/metrics/print.go PrintByTask and dashFloat; print_test.go TestPrintByTaskRatioColumns asserts 1.50/2.50 and -/-"},
    {"criterion": "`--json` by_task entries gain test_code_ratio and per_1000_code_lines_usd, null where the task's code lines are 0; schemas/metrics.v2.json gains both as optional properties of a by_task item, and the output still validates against metrics/v2.", "met": true, "evidence": "ReportTask pointer fields without omitempty in metrics.go; schemas/metrics.v2.json adds both as optional nullable numbers; the new TestByTaskRatiosAndJSONNull asserts null and value output"},
    {"criterion": "The summary's cost line ends ` · $<c>/kloc` instead of ` · $<c> per 1,000 code lines`; its figure still uses delivered code lines.", "met": true, "evidence": "internal/metrics/print.go:117 prints %s/kloc from r.Cost.Per1000Code, unchanged; cli and b3 e2e expectations updated"},
    {"criterion": "The all-briefs table's headers t:c and $/1k become test:code and $/kloc; the values are unchanged.", "met": true, "evidence": "print.go printBriefTable header; internal/cli/metrics_test.go TestMetricsCommandCrossBrief"},
    {"criterion": "The earlier tests that change are only internal/metrics/print_test.go, internal/metrics/lines_test.go, internal/cli/metrics_test.go, cmd/vloop/b3_e2e_test.go and cmd/vloop/run_iterate_test.go, and only by the two per-task columns, the cost line's `$<c>/kloc` and the all-briefs headers; committed tests cover both columns, the `-` and null cases and the new summary ending.", "met": true, "evidence": "changed tests are print_test.go, cli/metrics_test.go and b3_e2e_test.go only, with only those edits; TestByTaskRatiosAndJSONNull covers byTask nil for a zero-code task and the JSON null fields"}
  ],
  "findings": [],
  "notes": "Docs still say 'per 1,000 code lines' (T13's per the work notes)."
}
