{
  "schema": "verdict/v1",
  "task": "T8",
  "verdict": "PASS",
  "criteria": [
    {"criterion": "plugin/skills/operate/SKILL.md says that whenever it brings the operator a decision it proposes up to three real options, never a straw option to reach three, recommends one and says why, and after the operator decides records the intervention with `--option`, `--recommended`, `--why`, the decided choice (`--decided-option`/`--adjusted` or `--decided-other`, and `--decided`) and `--context` (the run, iteration and task; the commit or files; the triggering output quoted briefly; what changed because of it); options are only what it proposed before the operator decided. Violation to rule against: any instruction that pads to three or reconstructs options after the fact.", "met": true, "evidence": "plugin/skills/operate/SKILL.md new section 'Decisions: propose options, then record them': three is a ceiling, no straw option, recommend and say why, full flag list in the add example, --adjusted/--decided-other, and an explicit ban on reconstructing options afterwards."},
    {"criterion": ".claude/skills/vloop-operator/SKILL.md step 6 records with `vloop intervention add` and these flags, and names `vloop intervention migrate` where the index is refreshed.", "met": true, "evidence": "Step 6 in the diff uses vloop intervention add with --option, --recommended, --why, --decided-option/--adjusted/--decided-other, --decided and --context, and names vloop intervention migrate next to the tools/interventions-index.sh refresh."},
    {"criterion": "plugin/evals/operate-proposes-options is a complete eval case (case.yaml, prompt.md invoking /vloop:operate with max_turns and allowed_tools, scaffold.sh, graders/*.md): its scaffold builds a repository whose run halted on a gate dispute, and its graders score proposing one to three options with a recommendation and its reason, not amending the gate before the operator answers, and the absence of a straw option.", "met": true, "evidence": "The case has case.yaml, prompt.md (/vloop:operate, max_turns 30, allowed_tools), scaffold.sh (T1 blocked on a gate dispute) and task.json. Graders: options-with-recommendation.md, gate-not-amended.md and gate-file-untouched.md, and no-straw-option.md. It follows the structure of work-disputes-impossible-gate."},
    {"criterion": "plugin/evals/README.md lists the case; TestEvalGrantsCoverFence passes with it (its allowed_tools cover the fence and appear in the evals guide's --allow-tools).", "met": true, "evidence": "plugin/evals/README.md gains a table row for operate-proposes-options. The driver's go check ran with exit 0, and its log shows all packages ok."}
  ],
  "findings": [],
  "notes": "No behaviour code changed, so no committed Go test was added, and none was needed: the eval case is the gate. No absolute paths in the diff."
}
