{"schema":"verdict/v1","task":"T3","verdict":"PASS",
"criteria":[
{"criterion":"tools/release is `package main` in this module (it may use internal packages); no new dependency in go.mod, and no `vloop` subcommand is added for releasing.","met":true,"evidence":"tools/release/main.go is package main; go.mod untouched in the diff; no cmd changes"},
{"criterion":"`notes <from> <to>` prints, on stdout with exit 0, the brief's exact Markdown: `## Briefs`, a blank line, `- **<title>** — <description>` lines; a blank line; `## Other changes`, a blank line, `- <subject>` lines. A section with no lines is left out; with neither the output is `No changes.`","met":true,"evidence":"main.go notes() section assembly; TestNotes and TestNotesEmptySections assert exact strings"},
{"criterion":"Commits are those after <from> up to and including <to> (tags or revisions). A brief is named by a commit's `Vloop-Brief: <name>` trailer; one line per brief, oldest first; <title> is the brief's first heading with a leading `Brief — ` and `vloop ` removed, else the brief's name; <description> is its frontmatter description; both read at <to>.","met":true,"evidence":"git log from..to --reverse, trailer parsing, dedupe, briefLine reads rev:<to>; test covers v1..mid description at <to>, fallback to name"},
{"criterion":"Other changes are the commits without the trailer whose changes touch a file outside docs/, .vloop/ and CLAUDE.md and whose subject does not start `Release v`, oldest first.","met":true,"evidence":"touchesCode and Release v prefix check in notes(); test covers docs-only, release and README commits"},
{"criterion":"Refusals are one stderr line starting `release: `; exit codes are 0 done, 1 refused or failed, 2 usage (a wrong number of arguments or an unknown subcommand).","met":true,"evidence":"run() returns 2 for usage, 1 with oneLine release: message; TestNotesRefusals asserts codes and a single stderr line"},
{"criterion":"The task's notes carry the real-data check, run on a clone of this repository: the full output of `notes v0.10.0 v0.11.0` (B16 alone under Briefs) and of `notes v0.9.0 v0.10.0` (B13, B14 and B15).","met":true,"evidence":"proposal notes include both outputs with B16 alone and B13/B14/B15; run read-only on the repo rather than a clone because clone was denied, which is equivalent for read-only git log/show"},
{"criterion":"Committed tests, run by the checks, cover the notes format, the trailer, title and description rules, the exclusions and the empty sections, building their repositories in temporary directories with a temporary HOME and git -C; no test reads this repository's history or reaches the network.","met":true,"evidence":"main_test.go newRepo uses t.TempDir, temp HOME, git -C; go check exit 0"}],
"findings":[],
"notes":"The real-data check ran on the working repo, not a clone; read-only so harmless."}
