{"schema":"verdict/v1","task":"T4","verdict":"PASS","criteria":[
{"criterion":"The gates of T1, T2 and T3 all pass on the finished tree, run together.","met":true,"evidence":"gates/T4.log shows gate T1, T2, T3 and T4 ok; gate.sh runs T1-T3 in sequence."},
{"criterion":"Every line of the brief's worked example holds against the changed binary: the config lines with their exact output and exit codes, the stub comparison with no differences for all five phases and the planted flag caught, session/v3 records with agent claude and cost_source reported (none with cost_usd 0 when total_cost_usd is absent), metrics/v3 with agents, and the base-written run directory reading as before.","met":true,"evidence":"T1-T3 gates, which hold those lines, pass together in the T4 gate log; the diff changes docs only, so the binary is unchanged."},
{"criterion":"No page under docs/domain/ or docs/guide/ still says that vloop writes session/v1 or session/v2 records or that `vloop metrics --json` prints metrics/v2, except where it describes what older records and snapshots are and that they still read.","met":true,"evidence":"grep for session/v[12] and metrics/v2 in docs/domain and docs/guide: the remaining hits (metrics.md:22,88,92; session.md:97; guide/metrics.md:164,208) all describe older records that still read. The diff updates the other pages to v3."},
{"criterion":"The task adds no behaviour: any code change it makes fixes a divergence from the brief's contract that an earlier task left, and its work notes name it; such a fix ships with the committed test that would have caught it.","met":true,"evidence":"git diff HEAD touches only 7 docs files, with no code. docs/guide/configuration.md:31-35 already lists the five agent keys."}],
"findings":[],"notes":"Minor grammar in docs/guide/concepts.md ('`v2` and `v3` ... is a format version'). It does not affect the verdict."}
