{
  "schema": "verdict/v1",
  "task": "T5",
  "verdict": "PASS",
  "criteria": [
    {"criterion": "The plan fence allows Edit and Write of `.vloop/state/gates/**` beside `.vloop/state/state.json`; the work and review fences deny them; a gate folder whose id is not in the plan refuses the plan (exit 1, nothing committed).", "met": true, "evidence": "fence/plan.json (attempt 1) allows the gates; work/review fences unchanged. cmd/vloop/run_gates_test.go TestRunRefusesStrayGateFolder asserts exit 1, the message, zero plan commits and no leftover state or folder."},
    {"criterion": "At acceptance the driver stamps each task's `fixtures`: lower-case hex SHA-256 over the folder's regular files sorted by path, each fed as `<path>\\0<contents>\\0` with the path relative to the gate folder and `/`-separated, so the value is the same on every OS; a task with no folder gets \"\". The digest is a pure function with a unit test that runs on every OS.", "met": true, "evidence": "internal/state/fixtures.go FixturesDigest; TestFixturesDigest and TestStampAndStray in fixtures_test.go; TestRunRefusesChangedGateFixtures checks the stamp is non-empty after the plan."},
    {"criterion": "VLOOP_PLAN_SHA256 covers state.json and every gate folder; the driver holds both in memory, restores whatever any session changed among them after the session, and `vloop task gate` refuses on a mismatch with the existing message.", "met": true, "evidence": "safety.go stateGuard and RestoreGateFiles; TestStateGuardGateFolders, TestPlanDigestAndRestore, TestTaskGatePlanHash."},
    {"criterion": "`vloop run` resuming a plan whose gate folder no longer matches a task's fixtures refuses with `vloop: the gate fixtures of T<n> changed outside vloop task verify — record the change with vloop task verify T<n> --reason '<why>'` (exit 1), starting no session.", "met": true, "evidence": "driver.CheckFixtures; TestRunRefusesChangedGateFixtures edits the folder, runs, asserts exit 1, the exact message and no new sessions."},
    {"criterion": "`vloop task verify <id> [<command>] --reason '<why>'` takes the command optionally; it appends a gate_history entry {verify (old), fixtures (old), replaced_at, reason, by: operator}, then sets the command if given and re-stamps fixtures from the folder; with neither a new command nor a changed folder it refuses with `vloop: nothing to record — T<n>'s gate and fixtures are unchanged` (exit 1).", "met": true, "evidence": "state.RecordGate; TestRecordGate, TestTaskVerifyFolder, TestTaskVerifyRefusals."},
    {"criterion": "TestRun33GateRewrite's replacement tests the folder restore; TestTaskVerifyReplaces, TestTaskVerifyRefusals and TestTaskGatePlanHash follow G2; tests cover the stamp, the stray-folder refusal and the resume refusal.", "met": true, "evidence": "The two new tests in cmd/vloop/run_gates_test.go close the previously missing coverage; both pass when run. Restore is covered by TestStateGuardGateFolders."}
  ],
  "findings": [],
  "notes": "Attempt 2 only adds tests (no pre-existing test or gate modified). The implementation is from attempt 1, previously judged met on every criterion but coverage. No gate-review phase exists yet, so no guard for it here."
}
