{"schema":"verdict/v1","task":"T4","verdict":"PASS","criteria":[
{"criterion":"Keys: `run.second-review` (`off` default, `record`, `feedback`, `on-pass`, `both-pass`), `agent.second-review` (`claude` default, `copilot`), `model.second-review` (default `sonnet`), `effort.second-review` (the effort values, unset by default), each with its `VLOOP_` variable; an invalid value exits 2.","met":true,"evidence":"internal/config/config.go adds the four keys with defaults and Valid lists; configuration.md table lists the variables; config_test.go extended; e2e_test.go config list updated."},
{"criterion":"`vloop doctor` with `run.second-review` off says nothing of the second review; otherwise a row names the mode, agent and model, and `! run.second-review: the second reviewer is the primary's agent and model — it adds no independence` appears when both match the primary's configured agent and model.","met":true,"evidence":"doctor.go doctorSecondReview returns early when off, else adds the row and the warning; doctor_second_review_test.go covers both."},
{"criterion":"The Copilot warning reads `! agent.review is copilot: experimental (docs/guide/configuration.md)` in doctor and the run preflight, and `! agent.second-review is copilot: experimental (docs/guide/configuration.md)` for a copilot second reviewer, whose doctor rows include the copilot checks (on PATH, --version, login).","met":true,"evidence":"copilotExperimental reworded; doctorCopilot loops over copilotKeys; run.go preflight prints the warning for both keys; TestDoctorCopilotSecondReviewer asserts the text."},
{"criterion":"A copilot second review in use with the default `model.second-review` is refused before any session, naming `model.second-review`, as `agent.review` is; K1's skill refusal also applies when `agent.second-review` is copilot and the second review is in use, and not when `run.second-review` is off.","met":true,"evidence":"run.go preflight loops over keys for the default-model refusal and skillClashes; TestRunPreflightCopilotSecondReview checks the model refusal, the skill clash and no refusal when off."},
{"criterion":"Committed tests cover the keys, the doctor rows and the refusals, and run in the `go` check.","met":true,"evidence":"config_test.go, doctor_second_review_test.go, doctor_copilot_test.go; checks.json shows go exit 0."}],
"findings":[],"notes":"The current attempt only fixed e2e_test.go's config list to include the new keys, which is licensed by the contract change (new keys)."}
